{
  "type": "array",
  "$schema": "http://json-schema.org/draft-04/schema#",
  "description": "",
  "minItems": 1,
  "uniqueItems": true,
  "items": {
    "type": "object",
    "required": [
      "id",
      "title",
      "image",
      "language",
      "description",
      "type",
      "questions"
    ],
    "properties": {
      "id": {
        "type": "number"
      },
      "title": {
        "type": "string",
        "minLength": 1
      },
      "image": {
        "type": "array",
        "items": {
          "required": [],
          "properties": {}
        }
      },
      "language": {
        "type": "string",
        "minLength": 1
      },
      "description": {
        "type": "string",
        "minLength": 1
      },
      "type": {
        "type": "number"
      },
      "questions": {
        "type": "array",
        "uniqueItems": true,
        "minItems": 1,
        "items": {
          "required": [
            "id",
            "description",
            "skill"
          ],
          "properties": {
            "id": {
              "type": "number"
            },
            "description": {
              "type": "string",
              "minLength": 1
            },
            "image": {
              "type": "array",
              "items": {
                "required": [],
                "properties": {}
              }
            },
            "skill": {
              "type": "number"
            },
            "answers": {
              "type": "array",
              "uniqueItems": true,
              "minItems": 1,
              "items": {
                "required": [
                  "id",
                  "text",
                  "value"
                ],
                "properties": {
                  "id": {
                    "type": "number"
                  },
                  "text": {
                    "type": "string",
                    "minLength": 1
                  },
                  "image": {
                    "type": "string",
                    "minLength": 1
                  },
                  "value": {
                    "type": "number"
                  }
                }
              }
            }
          }
        }
      }
    }
  }
}