{	
    "id": 1,
    "title": "Escenario - Habilidades Blandas",
	"image": [
		"principalHD.png"
		],
    "language": "es",
	"description": "El escenario presentado incluye una situación posible. Se tiene que seleccionad la que mejor encaje con su personalidad",
	"type":	1,
    "questions": [
      {
        "id": 1,
        "description": "El/la trabajador/a está yendo a traajar, pero llega tarde porque se ha quedado dormido. En consecuencia, no llegará a tiempo al trabajo.",
        "image": [
			"p11.png",
			"p12.png",
			"p13.png"
			],
        "skill": 1,
        "answers": [
          {
			"id": 1,
            "text": "Aumenta la velocidad para que el viaje dure menos tiempo, evitando problemas con su superior.",
            "image": "p111.png",
            "value": 1
          },
          {
			"id": 2,
            "text": "Llega tarde al trabajo y pone como excusa un problema con el coche.",
            "image": "p112.png",
            "value": 2
          },
          {
			"id": 3,
            "text": "Llama a su superior para notificarle la probabilidad de que llegue tarde.",
            "image": "p113.png",
            "value": 3
          },
          {
			"id": 4,
            "text": "Va al trabajo y trata de acabar las tareas en menos tiempo del que estaba inicialmente programado.",
            "image": "p114.png",
            "value": 4
          }
        ]
      }
    ]
}